<?xml version="1.0" encoding="UTF-8" standalone="yes"?>
<xs:schema version="1.0" xmlns:xs="http://www.w3.org/2001/XMLSchema">

	<xs:include schemaLocation="../import.xsd" />
	<xs:include schemaLocation="../global_types.xsd" />

	<xs:element name="skill_tree">
		<xs:complexType>
			<xs:sequence>
				<xs:element ref="import" minOccurs="0" maxOccurs="unbounded" />
				<xs:element name="skill" type="SkillTreeEntry" minOccurs="0"
					maxOccurs="unbounded" />
			</xs:sequence>
		</xs:complexType>
	</xs:element>

	<xs:complexType name="SkillTreeEntry">
		<xs:attribute name="classId" type="xs:string" use="required"/>
		<xs:attribute name="skillId" type="xs:int" use="required"/>
		<xs:attribute name="skillLevel" type="xs:int" use="required"/>
		<xs:attribute name="name" type="xs:string" use="required"/>
		<xs:attribute name="race" type="xs:string" use="required"/>
		<xs:attribute name="minLevel" type="xs:int" use="required"/>
		<xs:attribute name="type" type="xs:string" use="required"/>
	</xs:complexType>
	
	<xs:simpleType name="skillRace">
		<xs:restriction base="xs:string">
			<xs:enumeration value="ELYOS" />
			<xs:enumeration value="ASMODIAN" />
			<xs:enumeration value="ALL" />
		</xs:restriction>
	</xs:simpleType>

</xs:schema>